{
  "$schema": "../../packages/react-cosmos/config.schema.json",
  "lazy": true,
  "globalImports": ["src/global.css"],
  "staticPath": "static",
  "webpack": {
    "overridePath": "webpack.override.js"
  },
  "plugins": [
    "react-cosmos-plugin-boolean-input",
    "react-cosmos-plugin-open-fixture",
    "react-cosmos-plugin-webpack"
  ]
}
